{
  "format": "schemagic-design-profile",
  "schemaVersion": "1.0.0",
  "partClass": "shared.n-channel-power-mosfet",
  "part": {
    "manufacturerId": "texas-instruments",
    "manufacturerPartNumber": "CSD18540Q5B"
  },
  "factsSchemaVersion": "3.0.0",
  "commonFacts": {
    "packageName": {
      "value": "SON 5-mm x 6-mm plastic package (Q5B)",
      "state": "reviewed",
      "evidence": [
        {
          "sourceId": "ti-csd18540q5b-datasheet",
          "locator": "page 1, Device Information: CSD18540Q5B uses a SON 5.00-mm x 6.00-mm plastic package; package drawing section identifies Q5B",
          "licenseNote": "Manufacturer-published factual data referenced by URL; the source document is not redistributed.",
          "kind": "manufacturer_datasheet",
          "retrievedAt": "2026-08-24T07:41:52Z",
          "contentHash": "sha256:2e43c4a2ac82af8a089be0a9e413282326f8d7857254ac07390b458deca854e0",
          "url": "https://www.ti.com/lit/ds/symlink/csd18540q5b.pdf",
          "revision": "SLPS488B, revised April 2017; Package Option Addendum dated 10-Nov-2025",
          "publicationBasis": "public_facts"
        }
      ],
      "validFor": [],
      "explanation": "The exact CSD18540Q5B device row identifies TI's Q5B SON 5-mm x 6-mm package."
    },
    "boardArea": {
      "value": null,
      "state": "unknown",
      "evidence": [],
      "validFor": [],
      "explanation": "Facts schema 3.0.0 represents mounted board area only through facts.mountedGeometry."
    },
    "maximumHeight": {
      "value": null,
      "state": "unknown",
      "evidence": [],
      "validFor": [],
      "explanation": "Facts schema 3.0.0 represents mounted maximum height only through facts.mountedGeometry."
    }
  },
  "facts": {
    "drainSourceVoltage": {
      "value": {
        "value": 60,
        "unit": "V",
        "displayUnit": "60 V"
      },
      "state": "reviewed",
      "evidence": [
        {
          "sourceId": "ti-csd18540q5b-datasheet",
          "locator": "page 1, Absolute Maximum Ratings at TA = 25 deg C: VDS drain-to-source voltage = 60 V",
          "licenseNote": "Manufacturer-published factual data referenced by URL; the source document is not redistributed.",
          "kind": "manufacturer_datasheet",
          "retrievedAt": "2026-08-24T07:41:52Z",
          "contentHash": "sha256:2e43c4a2ac82af8a089be0a9e413282326f8d7857254ac07390b458deca854e0",
          "url": "https://www.ti.com/lit/ds/symlink/csd18540q5b.pdf",
          "revision": "SLPS488B, revised April 2017; Package Option Addendum dated 10-Nov-2025",
          "publicationBasis": "public_facts"
        }
      ],
      "validFor": [],
      "explanation": "Manufacturer absolute-maximum drain-to-source voltage; this is a rating, not a recommended operating point."
    },
    "continuousDrainCurrent": {
      "value": {
        "value": 29,
        "unit": "A",
        "displayUnit": "29 A"
      },
      "state": "reviewed",
      "evidence": [
        {
          "sourceId": "ti-csd18540q5b-datasheet",
          "locator": "page 1, Absolute Maximum Ratings: unqualified continuous drain-current row = 29 A; footnote 1 gives the board thermal assumption",
          "licenseNote": "Manufacturer-published factual data referenced by URL; the source document is not redistributed.",
          "kind": "manufacturer_datasheet",
          "retrievedAt": "2026-08-24T07:41:52Z",
          "contentHash": "sha256:2e43c4a2ac82af8a089be0a9e413282326f8d7857254ac07390b458deca854e0",
          "url": "https://www.ti.com/lit/ds/symlink/csd18540q5b.pdf",
          "revision": "SLPS488B, revised April 2017; Package Option Addendum dated 10-Nov-2025",
          "publicationBasis": "public_facts"
        }
      ],
      "validFor": [
        {
          "parameterId": "ambientTemperature",
          "minimum": {
            "value": 298.15,
            "unit": "K",
            "displayUnit": "25 deg C"
          },
          "maximum": {
            "value": 298.15,
            "unit": "K",
            "displayUnit": "25 deg C"
          },
          "evidence": [
            {
              "sourceId": "ti-csd18540q5b-datasheet",
              "locator": "page 1, Absolute Maximum Ratings table heading: TA = 25 deg C",
              "licenseNote": "Manufacturer-published factual data referenced by URL; the source document is not redistributed.",
              "kind": "manufacturer_datasheet",
              "retrievedAt": "2026-08-24T07:41:52Z",
              "contentHash": "sha256:2e43c4a2ac82af8a089be0a9e413282326f8d7857254ac07390b458deca854e0",
              "url": "https://www.ti.com/lit/ds/symlink/csd18540q5b.pdf",
              "revision": "SLPS488B, revised April 2017; Package Option Addendum dated 10-Nov-2025",
              "publicationBasis": "public_facts"
            }
          ]
        }
      ],
      "explanation": "Ambient-qualified absolute-maximum current. The 29 A value depends on the source's 1-in2, 2-oz-copper FR4 board assumption and is not the separate 100 A package-limited or 205 A TC-qualified rating."
    },
    "pulsedDrainCurrent": {
      "value": {
        "value": 400,
        "unit": "A",
        "displayUnit": "400 A"
      },
      "state": "reviewed",
      "evidence": [
        {
          "sourceId": "ti-csd18540q5b-datasheet",
          "locator": "page 1, Absolute Maximum Ratings: IDM pulsed drain current at TA = 25 deg C = 400 A; footnote 2 limits pulse duration to 100 us and duty cycle to 1%",
          "licenseNote": "Manufacturer-published factual data referenced by URL; the source document is not redistributed.",
          "kind": "manufacturer_datasheet",
          "retrievedAt": "2026-08-24T07:41:52Z",
          "contentHash": "sha256:2e43c4a2ac82af8a089be0a9e413282326f8d7857254ac07390b458deca854e0",
          "url": "https://www.ti.com/lit/ds/symlink/csd18540q5b.pdf",
          "revision": "SLPS488B, revised April 2017; Package Option Addendum dated 10-Nov-2025",
          "publicationBasis": "public_facts"
        }
      ],
      "validFor": [
        {
          "parameterId": "dutyCycle",
          "minimum": null,
          "maximum": {
            "value": 0.01,
            "unit": "1",
            "displayUnit": "1 % maximum"
          },
          "evidence": [
            {
              "sourceId": "ti-csd18540q5b-datasheet",
              "locator": "page 1, Absolute Maximum Ratings footnote 2: duty cycle <= 1%",
              "licenseNote": "Manufacturer-published factual data referenced by URL; the source document is not redistributed.",
              "kind": "manufacturer_datasheet",
              "retrievedAt": "2026-08-24T07:41:52Z",
              "contentHash": "sha256:2e43c4a2ac82af8a089be0a9e413282326f8d7857254ac07390b458deca854e0",
              "url": "https://www.ti.com/lit/ds/symlink/csd18540q5b.pdf",
              "revision": "SLPS488B, revised April 2017; Package Option Addendum dated 10-Nov-2025",
              "publicationBasis": "public_facts"
            }
          ]
        },
        {
          "parameterId": "pulseDuration",
          "minimum": null,
          "maximum": {
            "value": 0.0001,
            "unit": "s",
            "displayUnit": "100 us maximum"
          },
          "evidence": [
            {
              "sourceId": "ti-csd18540q5b-datasheet",
              "locator": "page 1, Absolute Maximum Ratings footnote 2: pulse duration <= 100 us",
              "licenseNote": "Manufacturer-published factual data referenced by URL; the source document is not redistributed.",
              "kind": "manufacturer_datasheet",
              "retrievedAt": "2026-08-24T07:41:52Z",
              "contentHash": "sha256:2e43c4a2ac82af8a089be0a9e413282326f8d7857254ac07390b458deca854e0",
              "url": "https://www.ti.com/lit/ds/symlink/csd18540q5b.pdf",
              "revision": "SLPS488B, revised April 2017; Package Option Addendum dated 10-Nov-2025",
              "publicationBasis": "public_facts"
            }
          ]
        }
      ],
      "explanation": "Absolute-maximum pulsed current, retained only with the manufacturer's numeric upper bounds of 100 us pulse duration and 1% duty cycle; this is not a repetitive SOA guarantee."
    },
    "onResistance": {
      "value": {
        "value": 0.0022,
        "unit": "ohm",
        "displayUnit": "2.2 mOhm maximum"
      },
      "state": "reviewed",
      "evidence": [
        {
          "sourceId": "ti-csd18540q5b-datasheet",
          "locator": "page 3, Electrical Characteristics at TA = 25 deg C: RDS(on) maximum = 2.2 mOhm for VGS = 10 V and ID = 28 A",
          "licenseNote": "Manufacturer-published factual data referenced by URL; the source document is not redistributed.",
          "kind": "manufacturer_datasheet",
          "retrievedAt": "2026-08-24T07:41:52Z",
          "contentHash": "sha256:2e43c4a2ac82af8a089be0a9e413282326f8d7857254ac07390b458deca854e0",
          "url": "https://www.ti.com/lit/ds/symlink/csd18540q5b.pdf",
          "revision": "SLPS488B, revised April 2017; Package Option Addendum dated 10-Nov-2025",
          "publicationBasis": "public_facts"
        }
      ],
      "validFor": [
        {
          "parameterId": "ambientTemperature",
          "minimum": {
            "value": 298.15,
            "unit": "K",
            "displayUnit": "25 deg C"
          },
          "maximum": {
            "value": 298.15,
            "unit": "K",
            "displayUnit": "25 deg C"
          },
          "evidence": [
            {
              "sourceId": "ti-csd18540q5b-datasheet",
              "locator": "page 3, Electrical Characteristics table heading: TA = 25 deg C unless otherwise stated",
              "licenseNote": "Manufacturer-published factual data referenced by URL; the source document is not redistributed.",
              "kind": "manufacturer_datasheet",
              "retrievedAt": "2026-08-24T07:41:52Z",